Act or Con,Name,Row,[Prereq Concepts],[New Concepts (Activities Only)],[Representations],Course Number,Figure,Long Description,External URL,Status,Notes
Concept,Difference / Change,2,[],[],[$\Delta x$],MTH 251,,Understanding both difference (how far apart two values are at one time) and change (how far apart the value of a single parameter is at two different times) is necessary for understanding derivatives.,,Active,
Concept,How much $f$ changes as $x$ changes,3,[],[],[$\Delta x$],MTH 251,,"Conceptually, a derivative can be thought of as how much one value changes as another value changes. ",,Active,
Concept,The derivative is a ratio of small changes,4,[],[],[$\frac{\Delta f}{\Delta x}$],MTH 251,,One can view $\frac{df}{dx}$ as approximately given by a fraction where $df$ is a small change in $f$ and $dx$ is a small change in $x$.,,Active,
Concept,The derivative can be approximated by the slope of a secant line,5,[],[],[1D Graph],MTH 251,,The value of the derivative at a point on a curve can be approximated by the slope of a line secant with the curve near that point.,,Active,
Concept,The derivative at a point is the slope of a tangent line at that point,6,[The derivative at a point is the slope of a tangent line at that point],[],[1D Graph],MTH 251,,The value of the derivative at a point on a curve is equivalent to the slope of a line tangent to the curve at that point. The tangent line can be thought of as the limit of a secant line between two points infinitesimally close together,,Active,
Concept,The derivative is a limit,7,[The derivative is a ratio of small changes],[],[],MTH 251,,"Technically, the derivative is a ratio of small changes in the limit that the change in the denominator goes to zero: $\frac{df}{dx}=\lim_{h \rightarrow 0} \frac{f(x+h)-f(x)}{h}$",,Active,
Concept,The derivative is a function,8,[],[],[],MTH 251,,"The derivative of a function is itself a function, with the same domain as the origional function. Both the (derivative) funciton and the value of the derivative at a point are commonly referrd to as ""the derivative.""",,Active,
Concept,The derivative of a constant is zero,9,[Difference / Change],[],[],MTH 251,,"The derivative of a constant is always zero. This can be understood by thinking of 'The derivative is a ratio of small changes,' as the amount by which a constant changes is zero.",,Active,
Concept,The derivative is a linear function,10,[],[],[],MTH 251,,A long description for The derivative is a linear function is not yet available--feel free to give us your suggestions on the poster!,,Active,Do we mean that it is a linear operator? 
Concept,Power law,11,[],[],[],MTH 251,,The derivative with respect to $x$ of $x^A$ is $A \cdot x^{A-1}$.,,Active,
Concept,The derivative at a cusp is undefined,12,[],[],[1D Graph],MTH 251,," At a cusp (or kink) in a curve, the derivative (and it's value) are not defined.",,Active,
Concept,Variables can be held constant,13,[],[],[],MTH 251,,"When taking a derivative of a multivariable function, it is possible to consider a simplier situation in which some of the variables are considered to be constant. ",,Active,
Concept,Product rule,14,[],[],[$\frac{d f}{d x}$],MTH 251,,"When taking the derivative of a product with $n$ factors, the product rule gives that this derivative is equal a sum of $n$ terms, the $i$th of which is the origional function but with  the $i$th factor replaced by the derivative of the $i$th factor:  $\frac{d}{dt}(xy)=\frac{dx}{dt} y+x \frac{dy}{dt}$",,Active,
Concept,Single variable chain rule,15,[],[],[$\frac{d f}{d x}$],MTH 251,,"If $f=f(y)$ and $y=y(x), then \frac{df}{dy}=\frac{df}{dx}\frac{dx}{dy}.$",,Active,
Concept,You can flip a derivative,16,[],[],[$\frac{d f}{d x}$],MTH 251,,"In other words, $\frac{dy}{dx} = \frac{1}{\frac{dx}{dy}}$.  Note that this concept is challenging to express in Newton's notation, but arises naturally if implicit differentiation is covered.",,Active,
Concept,"""With respect to what"" matters",17,[],[],[$\frac{d f}{d x}$],MTH 251,,"Taking derivatives of the same function with respect to different variables will produce different results. In physics, these different results might have different dimensions and thus the derivative can have wildly different physical interpretations based off of ""'with respect to' what"". ",,Active,
Concept,Derivatives can be found while holding one or more variables constant,18,[Variables can be held constant],[],[$\left(\frac{\partial f}{\partial x}\right)_y$],MTH 254,,Derivatives of multivariable functions can be found by holding one ore more variables constant (subject to physical limitations). ,,Active,
Concept,There is a partial derivative in every direction at any point,19,[],[],[2D Graph],MTH 254,,"For a smooth, two dimensional function, a partial derivative can be found at any point and in any direction.",,Active,
Concept,There is a tangent line in every direction at every point,20,[],[],[2D Graph],MTH 254,,"For a smooth, two dimensional function, a tangent line exists at any point and in any direction.",,Active,
Concept,The derivative is related to the density of contour lines,21,[],[],[Contour Maps],MTH 254,,"The magnitude of the derivative of a function is directly related to how closely together lie contour lines of the function: the closer together the contour lines, the greater the magnitude of the derivative.",,Active,
Concept,The value of a partial derivative depends on the value(s) of what is held constant,22,[],[],[$\left(\frac{\partial f}{\partial x}\right)_y$],MTH 254,,A long description for The value of a partial derivative depends on the value(s) of what is held constant is not yet available--feel free to give us your suggestions on the poster!,,Active,Is this really a statement about paths? I don't think we have path-related concepts.
Concept,A partial derivative can be expressed in terms of other partial derivatives,23,[Single variable chain rule],[],"[$\frac{\partial f}{\partial x}$,$\left(\frac{\partial f}{\partial x}\right)_y$]",MTH 254,,A long description for A partial derivative can be expressed in terms of other partial derivatives is not yet available--feel free to give us your suggestions on the poster!,,Active,What do we really want to say in this long description?
Concept,The gradient is a vector,24,[],[],[$\vec \nabla f$],MTH 254,,"For an $n-$dimensional function $f$, the gradient of $f$ at a point is an $n-$dimensional vector ",,,
Concept,The magnitude of the gradient is the value of the slope in the steepest direction,25,"[The derivative at a point is the slope of a tangent line at that point,The gradient is a vector]",[],[$\vec \nabla f$],MTH 254,,A long description for The magnitude of the gradient is the value of the slope in the steepest direction is not yet available--feel free to give us your suggestions on the poster!,,Active,What more needs to be said in the long description?
Concept,The gradient is perpendicular to contour lines,26,[],[],[Contour Maps],MTH 254,,"As the gradient lies along the direction of greatest change for a function, and contour lines lie along the direction of no change, these two objects (the gradient and contour lines) are perpendicular.",,Active,
Concept,All partial derivatives can be found as a slope of a tangent plane,27,"[The derivative at a point is the slope of a tangent line at that point,There is a partial derivative in every direction at any point]",[],[2D Graph],MTH 254,,"Just as the derivative of a one-dimensional funtion at a point is equal to the slope of a tangent line at that point, and partial derivative of a multivariable function can be found as a slope of a tangent plane. ",,Active,
Concept,The derivative is a local quantity,28,[],[],[$\frac{d f}{d x}$],MTH 254,,"The value of the derivative is a function of the same variables as the original function. Thus, it's value depends on where the derivative is being evaluated. Geometrically, the derivative (slope) of a curve at a point is not a statement about the general shape of the curve but rather about the behavior of the curve immediately around that point. ",,Active,
Concept,Partial derivatives are functions,29,[The derivative is a function],[],"[$\frac{\partial f}{\partial x}$,$\left(\frac{\partial f}{\partial x}\right)_y$]",MTH 254,,The partial derivative of a function is itself a function (although taking a partial derivative at a point will just give a number). ,,Active,
Concept,The gradient is a function,30,[The derivative is a function],[],[$\vec \nabla f$],MTH 254,,The gradient of a function (unless taken at a single point) is itself a function,,Active,
Concept,The components of the gradient are partial derivatives,28,[],[],"[$\vec \nabla f$,$\left(\frac{\partial f}{\partial x}\right)_y$]",MTH 254,,This is the long description for The components of the gradient are partial derivatives. It is quite a long description!,,Active,What do we really want to say in the long description?
Activity,The Heater II,32,"[The derivative is a ratio of small changes, Variables can be held constant, ""With respect to what"" matters]",,[Contour Maps],MTH 254,mvheater2.jpg,"This small group activity is designed to help students interpret partial derivatives using contour diagrams. Students work in small groups to determine rates of change using a contour diagram showing isotherms over time and space. The whole class wrap-up discussion emphasizes giving a physical interpretation for the derivative, the value of units in thinking about functions and derivatives, and the need to specify “with respect to what” when finding derivatives in multivariable contexts.",mvheater2,Active,
Activity,The Hot Plate,33,"[The derivative at a point is the slope of a tangent line at that point, The derivative is a function, The derivative at a cusp is undefined, ""With respect to what"" matters]","[There is a partial derivative in every direction at any point, There is a tangent line in every direction at every point, The derivative is related to the density of contour lines, The value of a partial derivative depends on the value(s) of what is held constant]","[$\frac{\partial f}{\partial x}$, Contour Maps, Inclinometer]",MTH 254,mvhotplate.jpg,This small group activity using surfaces introduces a geometric interpretation of partial derivatives in terms of measured ratios of small changes. Students work in small groups to identify locations on their surface with particular properties. The whole class wrap-up discussion emphasizes the equivalence of multiple representations of partial derivatives.,mvhotplate,Active,
Activity,Chain Rule,34,"[The derivative is a function, The derivative is a linear function, Variables can be held constant, Product rule, ""With respect to what"" matters, Single variable chain rule]",[A partial derivative can be expressed in terms of other partial derivatives],[$\frac{\partial f}{\partial x}$],MTH 254,TreeDiagram.jpg,This activity is still in development!,mvchain,Active,
Activity,Chain Rule Measurements,35,"[The derivative at a point is the slope of a tangent line at that point, A partial derivative can be expressed in terms of other partial derivatives]",[],"[$\frac{\partial f}{\partial x}$, Inclinometer]",MTH 254,,"This small group activity using surfaces combines practice with the multivariable chain rule while emphasizing numerical representations of derivatives. Students work in small groups to measure partial derivatives in both rectangular and polar coordinates, then verify their results using the chain rule. The whole class wrap-up discussion emphasizes the relationship between a directional derivative in the r-direction and derivatives in x- and y-directions using the chain rule.",mvpchain,Active,
Activity,The Hillside,36,"[The derivative at a point is the slope of a tangent line at that point, Derivatives can be found while holding one or more variables constant, There is a partial derivative in every direction at any point, There is a tangent line in every direction at every point]","[The gradient points in the direction of greatest increase of the function,The magnitude of the gradient is the value of the slope in the steepest direction, The gradient is perpendicular to contour lines]","[$\frac{\partial f}{\partial x}$,surface, Inclinometer]",MTH 254,vchill.jpg,"This small group activity using surfaces introduces the gradient.  Students work in small groups to determine the steepest slope and direction at a given point, then compare these results with the computed gradient.  The whole class wrap-up discussion emphasizes the geometric properties of the gradient.",mvhillside,Active,
Activity,Directional Derivatives,37,"[The derivative is a linear function, There is a partial derivative in every direction at any point, A partial derivative can be expressed in terms of other partial derivatives]","[All partial derivatives can be found as a slope of a tangent plane, The components of the gradient are partial derivatives]","[$\frac{\partial f}{\partial x}$, Inclinometer,$\vec \nabla f$]",MTH 254,MathSurfaces1.jpg,"This small group activity using surfaces relates the geometric definition of directional derivatives to the components of the gradient vector. Students work in small groups to measure a directional derivative directly, then compare its components with measured partial derivatives in rectangular coordinates. The whole class wrap-up discussion emphasizes the relationship between the geometric gradient vector and directional derivatives.",mvdderiv,Active,
Concept,The gradient points in the direction of greatest increase of the function,,"[The derivative at a point is the slope of a tangent line at that point,The gradient is a vector]",,"[$\vec \nabla f$, surface, Contour Maps]",MTH 255,,At a point on a multivariable function there is a derivative in every direction. The derivative with the largest value is known as the gradient and it points in the direction in which the derivative of the function is the largest.,,Active,NEW
Concept,Each component of $d \vec r$ is an arbitrary small change between two arbitrary position vectors. ,39,[Difference / Change],[],[$d \vec r$],MTH 255,,A long description for Each component of $d \vec r$ is an arbitrary small change between two arbitrary position vectors.  is not yet available--feel free to give us your suggestions on the poster!,,Active,This concept doesn't make any sense.
Concept,The magnitude of $d\vec r$ is the length of a small step along a path,40,[Difference / Change],[],[$d \vec r$],PH 422,,A long description for The magnitude of $d\vec r$ is the length of a small step along a path is not yet available--feel free to give us your suggestions on the poster!,,Active,What more needs to be in the long description? What is the point?
Concept,The direction of $d\vec r$ is tangent to a path,41,[],[],[$d \vec r$],PH 422,,A long description for The direction of $d\vec r$ is tangent to a path is not yet available--feel free to give us your suggestions on the poster!,,Active,Tangent to what path? How is this useful?
Concept,The gradient can tell you a small change in a function in any direction (differentials edition),42,[Difference / Change],[],"[$\vec \nabla f$,$d \vec r$]",MTH 255,,$df=\vec \nabla f \cdot d \vec r$,,Active,
Concept,The divergence is a scalar field,43,[],[],[$\vec \nabla \cdot \vec v$],,,The divergence at a point is a scalar. Taking the divergence of a function yields a scalar at every value in the domain of that function: a scalar field,,Active,
Concept,$\vec\nabla\cdot\vec v = \frac{\partial v_x}{\partial x} + \frac{\partial v_y}{\partial y}+\frac{\partial v_z}{\partial z}$,44,[],[],[$\vec \nabla \cdot \vec v$],MTH 255,,,,Active,What are we really trying to say?
Concept,$\vec\nabla\times\vec v = \cdots$,45,[],[],[$\vec \nabla \times \vec v$],MTH 255,,,,Active,What are we really trying to say?
concept,$\oint\vec F\cdot d\vec A = \int\vec\nabla\cdot\vec F dV$,46,[],[],[],MTH 255,,,,Active,What are we really trying to say?
concept,$\oint \vec F\cdot d\vec r = \int \vec\nabla\times\vec F\cdot d\vec A$,47,[],[],[],MTH 255,,,,Active,What are we really trying to say?
Activity,The Master Formula,[],[],"[The gradient is a vector,The gradient points in the direction of greatest increase of the function,The magnitude of the gradient is the value of the slope in the steepest direction, The gradient is perpendicular to contour lines]","[$df$,$\vec \nabla f$,$d \vec r$]",MTH 255,,,,Active,NEW
Activity,The Hill,49,"[Derivatives can be found while holding one or more variables constant, There is a partial derivative in every direction at any point, The derivative is related to the density of contour lines, The value of a partial derivative depends on the value(s) of what is held constant]","[The gradient points in the direction of greatest increase of the function,The magnitude of the gradient is the value of the slope in the steepest direction, The gradient is perpendicular to contour lines]","[Contour Maps, $\vec \nabla f$]",MTH 255,vchill.jpg,"This small group activity is designed to reinforce the geometric definition of the gradient. Students work in small groups to construct the gradient vector at different points on a hill. Then, students compare and contrast their findings to reinforce that the gradient is a vector field, but also that it is a local quantity. The whole class wrap-up discussion emphasizes that the gradient lives in the domain, not on the graph.",vchill,Active,
Activity,The Valley,50,[The components of the gradient are partial derivatives],[The gradient can tell you a small change in a function in any direction (differentials edition)],[Contour Maps],MTH 255,vcvalley.jpg,"This small group activity is designed to reinforce the geometry of line integrals, and to set the stage for path independence, and builds on the Hill activity.  Students work in small groups to evaluate the elevation change along different paths. The whole class wrap-up discussion reinforces the importance of a “Use what you know!” strategy to evaluate line integrals, and emphasizes that different paths with the same endpoints must have the same elevation gain.",vcvalley,Active,Correct prereq concept?
Concept,Differential form of $\vec r$ in spherical and cylindrical coordinates,51,[The derivative is a local quantity],[],[$d \vec r$],PH 422,,A long description for Differential form of $\vec r$ in spherical and cylindrical coordinates is not yet available--feel free to give us your suggestions on the poster!,,Active,Isn't this just d vec r = d vec r? 
Concept,The gradient lives in the domain and has the same number of spacial dimensions as the origional function,52,[],[],[$\vec \nabla f$],PH 422,,"The gradient of an $n$ dimensional function is $n$ dimensional. This is not to be confused with the gradient having the same physical dimensions (e.g., Newtons) as the origional function.",,Active,
Concept,The gradient is a local quantity,53,[The derivative is a local quantity],[],[$\vec \nabla f$],PH 422,,"The magnitude and direction of the gradient depends on the behavior of the function infinitesimally near the point of interest.  For example, the gradient does not point in the direction of maxima a finite distance away (except accidentally), but rather in the direction of steepest slope at the point of interest.",,Active,
Concept,The electric field is the negative gradient of the electric potential,54,[],[],[$\vec \nabla f$],PH 422,,"While the magnitude of the electric field is equal to the gradient of the electric potential, the electric field points in the opposite direction of the gradient of the electric potential, and thus $\vec E = - \vec \nabla V$.",,Active,
Concept,The divergence is related to the total flux through a closed surface,55,[],[],[$\vec \nabla \cdot \vec v$],PH 422,,"If the total flux through a closed surface is not zero, then the divergence of the function at that point is non-zero. ",,Active,fixme
Concept,The divergence is a function,56,[The derivative is a function],[],[$\vec \nabla \cdot \vec v$],PH 422,,The divergence of a function (unless taken at a single point) is itself a function,,Active,Is this all that we want to say?
Concept,The divergence is a local quantity,57,[The derivative is a local quantity],[],[$\vec \nabla \cdot \vec v$],PH 422,,A long description for The divergence is a local quantity is not yet available--feel free to give us your suggestions on the poster!,,Active,fixme
Concept,The divergence of the electric field is equal to,58,[],[],[$\vec \nabla \cdot \vec v$],PH 422,,A long description for The divergence of the electric field is equal to is not yet available--feel free to give us your suggestions on the poster!,,Active,fixme (incomplete concept)
Concept,The divergence of the magnetic field is zero,59,[],[],[$\vec \nabla \cdot \vec v$],PH 422,,A long description for The divergence of the magnetic field is zero is not yet available--feel free to give us your suggestions on the poster!,,Active,Do we want to discuss the reasons or implications?
Concept,"The curl is related to the line integral around a closed loop. (""circulation"")",60,[],[],[$\vec \nabla \times \vec v$],PH 422,,"A long description for The curl is related to the line integral around a closed loop. (""circulation"") is not yet available--feel free to give us your suggestions on the poster!",,Active,Do we want to include how it is related?
Concept,the curl is a (vector) function,61,[The derivative is a function],[],[$\vec \nabla \times \vec v$],PH 422,,A long description for the curl is a (vector) function is not yet available--feel free to give us your suggestions on the poster!,,Active,What do we really want to say in the long description?
Concept,The curl is a local quantity,62,[The derivative is a local quantity],[],[$\vec \nabla \times \vec v$],PH 422,,A long description for The curl is a local quantity is not yet available--feel free to give us your suggestions on the poster!,,Active,What do we really want to say in the long description?
Concept,The magnetic field is equal to the curl of the magnetic vector potential,63,[],[],[$\vec \nabla \times \vec v$],PH 422,,A long description for The magnetic field is equal to the curl of the magnetic vector potential is not yet available--feel free to give us your suggestions on the poster!,,Active,What do we really want to say in the long description?
Concept,The curl of the electric field is zero in electrostatics,64,[],[],[$\vec \nabla \times \vec v$],PH 422,,A long description for The curl of the electric field is zero in electrostatics is not yet available--feel free to give us your suggestions on the poster!,,Active,What more needs to be said in the long description?
Concept,The divergence of the curl is equal to mu times the current in magneto-statics,65,[],[],"[$\vec \nabla \cdot \vec v$,$\vec \nabla \times \vec v$]",PH 422,,A long description for The divergence of the curl is equal to mu times the current in magneto-statics is not yet available--feel free to give us your suggestions on the poster!,,Active,What more needs to be in the long description?
Activity,Vector Differentials,66,"[Difference / Change, Each component of $d \vec r$ is an arbitrary small change between two arbitrary position vectors. ]","[Differential form of $\vec r$ in spherical and cylindrical coordinates, The magnitude of $d\vec r$ is the length of a small step along a path, The direction of $d\vec r$ is tangent to a path]","[$d \vec r$, 3D plots]",PH 422,vfdrvectorcurvi.jpg,"We use the vector differential to create a unified view of calculus. Students have a lot of difficulty writing down exact differentials and writing down equations for vectors in curvilinear coordinates. This activity allows students to use geometric reasoning to practice both of these skills.  In particular, students are provided with a variety of alternate tangible representations for rectangular, cylindrical, and spherical coordinates, including oatmeal cans, globes, pineapples, and pumpkins.",vfdrvectorcurvi,Active,
Activity,Acting out the Gradient,67,[The magnitude of the gradient is the value of the slope in the steepest direction],"[The gradient lives in the domain and has the same number of spacial dimensions as the origional function, The gradient is a local quantity]","[$\vec \nabla f$, Kinesthetic, Contour Maps]",PH 422,vfactinggrad.jpg,"Oftentimes, students are not correctly interpreting situations geometrically when it seems they are. This activity is designed to test the ability of a class to represent the gradient physically for a function $f(x,y)$ that represents an elliptical hill. In the activity, the students themselves as points distributed throughout the classroom represent a vector field, using their right arm as a vector pointing in the direction of the gradient. The instructor will also have the opportunity to clarify the proper gradient direction (in the $xy$-plan) for students that are pointing incorrectly (``up'' the hill).",vfactinggrad,Active,
Activity,Visualizing Gradient,68,"[The magnitude of the gradient is the value of the slope in the steepest direction, The gradient is perpendicular to contour lines]","[The gradient lives in the domain and has the same number of spacial dimensions as the origional function, The gradient is a local quantity]","[Kinesthetic, Vector Field Map, Contour Maps]",PH 422,vfgradient.jpg,"Building a geometric understanding of the gradient can be challenging for students, particularly in physics classrooms when their only prior exposure to the gradient is in mathematics courses. This activity is a follow-up to Acting out the Gradient, in which students use Mathematica to calculate and visualize the gradient for different representations of scalar fields.  Students explicitly compare and contrast these different representations, in particular identifying that the gradient is always perpendicular to constant surfaces.",vfgradient,Active,
