Act or Con,Name,Row,[Prereq Concepts],[New Concepts (Activities Only)],[Representations],Course Number,Figure,Long Description,External URL,Status,Notes
Activity,Visualizing Divergence,69,"[The derivative is a ratio of small changes, The derivative is a limit, The derivative is a function, The divergence is a scalar field]","[The divergence is related to the total flux through a closed surface, The divergence is a function, The divergence is a local quantity]",[Vector Field Map],PH 422,vfdivergence.jpg,"The traditional discussion of divergence in vector calculus derives an algebraic expression in rectangular coordinates. We prefer to give a geometric derivation as flux per unit volume through an appropriately shaped box. In this activity, students learn how to predict the value of the divergence at any point by looking at the vector field near that point.  The activity is an excellent one for fostering representational fluency, as students can be asked to engage with vector field maps on paper, plots in Mathematica, and symbolic expressions for vector fields.  A nice extension is to have students consider vector fields that have different fundamental symmetries and to recognize that they can adjust the shape of the infinitesimal box to take advantage of such symmetry.",vfdivergence,Active,
Activity,Visualizing Curl,70,"[The derivative is a ratio of small changes, The derivative is a limit, The derivative is a function]","[The curl is related to the line integral around a closed loop. (""circulation""), the curl is a (vector) function, The curl is a local quantity]",[Vector Field Map],PH 422,vfcurlvis.jpg,"The traditional discussion of curl in vector calculus derives an algebraic expression in rectangular coordinates. As with divergence (see the Visualizing Divergence activity), we prefer to give a geometric derivation as circulation per unit area around an appropriately shaped closed curve. In this activity, students learn how to predict the value of the curl at any point by looking at the vector field near that point.  The activity is an excellent one for fostering representational fluency, as students can be asked to engage with vector field maps on paper, plots in Mathematica, and symbolic expressions for vector fields.  A nice extension is to have students consider vector fields that have different fundamental symmetries and to recognize that they can adjust the shape of the infinitesimal box to take advantage of such symmetry.",vfcurlvis,Active,
Concept,Differentials are small changes or differences,71,[Difference / Change],[],[$df$],PH 423,differentials.jpg,"One typical notation used for derivatives is Leibniz notation ($e.g.,$ $df/dx$).  Physicists often think of the $df$ and $dx$ as distinct quantities (``differentials'') that can be measured, calculated, and manipulated independent of one another.  In particular, a differential can be thought of as the (small) change in a quantity when a small change is made to a physical system.  A differential can also be thought of as the difference between the values of a quantity between two different (nearby) physical states.  This line of thinking is also valuable for thinking about integration in physical situations.",,Active,
Concept,Equations can be 'zapped with d' to relate differentials,72,[],[],[$df$],PH 423,,A long description for Equations can be 'zapped with d' to relate differentials is not yet available--feel free to give us your suggestions on the poster!,,Active,70 How is zapping with d different than taking the total derivative?
Concept,Individual differentials can be manipulated algebraically,73,[],[],[],PH 423,,A long description for Individual differentials can be manipulated algebraically is not yet available--feel free to give us your suggestions on the poster!,,Active,
Concept,Total differentials are linear,74,[],[],[$df$],PH 423,,"No matter how complicated a multivariable function is when written as an equation, the total differential of that function will be linear in the differential terms. In other words: $dF(x,y,z)=A dx + B dy + C dz.$",,Active,
Concept,Differentials are small chunks,75,[],[],[$df$],PH 423,,"$df$ can be viewed as a small chunk of $f$. When combined with 'The derivative is a ratio of small changes', it's easy to relate differentials to derivatives.",,Active,
Concept,There are experimental limits to how $small$ of a change can be measured,76,[The derivative is a ratio of small changes],[],"[$\Delta x$,$dx$,Experiment]",PH 423,,"While it is relatively easy to imagine very, very small changes in physical values, there are often experimental limits on how small of a change can be measured. When designing and conducting experiments, there is a tension between these experimental limitations and normative representations of functions as smooth lines or ",,Active,
Concept,The derivative can be interpreted physically,77,[],[],[],PH 423,,"While the constituents of a derivative (the $f$ and $x$ in $\frac{df}{dx}$) can have physical interpretations, the derivative itself can have a different physical interpretation. For example, $\frac{dx}{dt}$ is a velocity.",,Active,Better example needed
Concept,Partial derivatives that do not have the same variable(s) held constant are not the same derivative,78,"[Derivatives can be found while holding one or more variables constant,The value of a partial derivative depends on the value(s) of what is held constant]",[],[$\left(\frac{\partial f}{\partial x}\right)_y$],PH 423,$\left(\frac{\partial f}{\partial x}\right)_y \neq \left(\frac{\partial f}{\partial x}\right)_z$,A long description for Partial derivatives that do not have the same variable(s) held constant are not the same derivative is not yet available--feel free to give us your suggestions on the poster!,,Active,
Concept,Partial derivatives are coefficients in a differentials equation,79,"[The derivative is a ratio of small changes,Differentials are small changes or differences]",[],"[$\frac{\partial f}{\partial x}$,$\left(\frac{\partial f}{\partial x}\right)_y$]",PH 423,$df = \left(\frac{\partial f}{\partial x}\right)_y dx + \left(\frac{\partial f}{\partial y}\right)_x dy$,A long description for Partial derivatives are coefficients in a differentials equation is not yet available--feel free to give us your suggestions on the poster!,,Active,
Concept,You can flip a partial derivative if the same variable(s) are constant,80,"[You can flip a derivative, Derivatives can be found while holding one or more variables constant]",[],"[$\left(\frac{\partial f}{\partial x}\right)_y$,$\frac{\partial f}{\partial x}$]",PH 423,,"In other words, \[\left(\frac{\partial y}{\partial x}\right)_z = \frac1{\left(\frac{\partial x}{\partial y}\right)_z}. \]  Note that this equality is only true if the same variables are being held fixed on each side of the equality.  This therefore relies on the thermodynamics notation that specifies what quantities are being held fixed for a partial derivative.",,Active,
Concept,There might be experimental limits on which quantities you can measure,81,[],[],[Experiment],PH 423,,"While it may be possible to conceptualize a particular derivative, such as $\left(\frac{\partial U}{\partial S}\right)_{V},$ Where $U$ is internal energy, $S$ is entropy, and $V$ is volume, that does not mean that the particular derivative can be directly measured. In the above example, the entropy $S$ is not measurable. ",,Active,
Concept,Differentials allow the finding of partial derivatives when a variable cannot be solved for,82,[Total differentials are linear],[],[$df$],PH 423,,"Because total differentials are linear, one can find the total differential and then solve algebraically to obtain partial derivatives that might not be obtainable though differentiation. ",,Active,
Activity,Zapping with d,83,"[Difference / Change, The derivative is a ratio of small changes, The derivative can be approximated by the slope of a secant line, The derivative is a limit, The derivative is a function, Variables can be held constant]","[Differentials are small changes or differences, Equations can be 'zapped with d' to relate differentials, Individual differentials can be manipulated algebraically, Total differentials are linear]",[$df$],PH 423,LPsmall.jpg,"We would like our students to have both a practical and mathematical understanding of a total differential. In particular, with this activity students learn what the consequences of ``zapping'' a function with the operator ``d'' are. This activity also opens up a conversation on infinitesimals, and their relation to total differentials. The use of variables not associated with the Partial Derivative Machine in this activity allows students to apply the mathematical techniques they have been practicing during the course to a less familiar physical system.",inzapd,Active,
Activity,Energy and Integrals,84,"[Differentials are small changes or differences, Individual differentials can be manipulated algebraically]",[Differentials are small chunks],"[PDM, $df$]",PH 423,inpotentiallab.jpg,This integrated lab activity is designed to ask upper-division undergraduate students to measure the change in potential energy in an elastic system (PDM) between two different states. Students use the Partial Derivative Machine (PDM) to verify experimentally that the forces and dimensions of their system are state variables as well as measure the relationships between these quantities to compute the potential energy of their system. The whole class discussion focuses on the meaning of integration of discrete experimental data.,inpotentiallab,Active,
Activity,Partial Derivative Machine Derivatives,85,"[The derivative is a ratio of small changes, Variables can be held constant, Derivatives can be found while holding one or more variables constant, The value of a partial derivative depends on the value(s) of what is held constant, Differentials are small changes or differences]","[There are experimental limits to how $small$ of a change can be measured, The derivative can be interpreted physically, Partial derivatives that do not have the same variable(s) held constant are not the same derivative, Partial derivatives are coefficients in a differentials equation]","[PDM, $\frac{\partial f}{\partial x}$,$\left(\frac{\partial f}{\partial x}\right)_y$,Table]",PH 423,PDMD.jpg,"In this activity, students experimentally determine various derivatives using the partial derivate machine, a mechanical analogue for thermodynamic systems. Students explore the ratio, limit, and function aspects of multi-variable derivatives, with an emphasis on holding different variables constant. This activity is also an excellent exercise in representational fluency, as students must coordinate experiments and tables of data with (new) symbolic notations. $\textrm{Leibniz Notation}\\ \frac{\partial f}{\partial x} \rightarrow \left(\frac{\partial f}{\partial x}\right)_y$",inisowidth,Active,
Activity,Chain Rules,86,"[The derivative is a ratio of small changes, The derivative is a function, Variables can be held constant, Derivatives can be found while holding one or more variables constant, A partial derivative can be expressed in terms of other partial derivatives, Differentials are small changes or differences, Equations can be 'zapped with d' to relate differentials, Individual differentials can be manipulated algebraically, Partial derivatives that do not have the same variable(s) held constant are not the same derivative, Partial derivatives are coefficients in a differentials equation]","[You can flip a partial derivative if the same variable(s) are constant, There might be experimental limits on which quantities you can measure, Differentials allow the finding of partial derivatives when a variable cannot be solved for]",[$df$],PH 423,pdm.jpg,"NOT CORRECT DESCRIPTION: In this activity, students experimentally determine various derivatives using the partial derivate machine, a mechanical analogue for thermodynamic systems. Students explore the ratio, limit, and function aspects of multi-variable derivatives, with an emphasis on holding different variables constant. This activity is also an excellent exercise in representational fluency, as students must coordinate experiments and tables of data with (new) symbolic notations.",incycchainrule,Active,Not the correct description!
,,,,,,,,,,,Name the Experiment (x3)
,,,,,,,,,,,Name the Experiment (x3)
,,,,,,,,,,,Name the Experiment (x3)
,,,,,,,,,,,Mixed Partials
,,,,,,,,,,,Maxwell's Relations
